,RQ6,ROYAL LIVERPOOL AND BROADGREEN UNIVERSITY HOSPITALS NHS TRUST,NON-ADMITTED,ALL CANCERS,34,33,1,97.06%,,33,0,0,0,1
,RA2,ROYAL SURREY COUNTY HOSPITAL NHS FOUNDATION TRUST,NON-ADMITTED,ALL CANCERS,73,72,1,98.63%,,72,1,0,0,0
,RD1,ROYAL UNITED HOSPITALS BATH NHS FOUNDATION TRUST,NON-ADMITTED,ALL CANCERS,75,75,0,100.00%,,75,0,0,0,0
,RM3,SALFORD ROYAL NHS FOUNDATION TRUST,NON-ADMITTED,ALL CANCERS,57,57,0,100.00%,,57,0,0,0,0
,RNZ,SALISBURY NHS FOUNDATION TRUST,NON-ADMITTED,ALL CANCERS,18,18,0,100.00%,,18,0,0,0,0
,RXK,SANDWELL AND WEST BIRMINGHAM HOSPITALS NHS TRUST,NON-ADMITTED,ALL CANCERS,24,24,0,100.00%,,24,0,0,0,0
,RHQ,SHEFFIELD TEACHING HOSPITALS NHS FOUNDATION TRUST,NON-ADMITTED,ALL CANCERS,143,141,2,98.60%,,141,2,0,0,0
,RK5,SHERWOOD FOREST HOSPITALS NHS FOUNDATION TRUST,NON-ADMITTED,ALL CANCERS,32,32,0,100.00%,,32,0,0,0,0
,RXW,SHREWSBURY AND TELFORD HOSPITAL NHS TRUST,NON-ADMITTED,ALL CANCERS,85,83,2,97.65%,,83,1,0,1,0
,RA9,SOUTH DEVON HEALTHCARE NHS FOUNDATION TRUST,NON-ADMITTED,ALL CANCERS,86,82,4,95.35%,,82,1,2,1,0
,RTR,SOUTH TEES HOSPITALS NHS FOUNDATION TRUST,NON-ADMITTED,ALL CANCERS,83,83,0,100.00%,,83,0,0,0,0
,RE9,SOUTH TYNESIDE NHS FOUNDATION TRUST,NON-ADMITTED,ALL CANCERS,6,6,0,100.00%,,6,0,0,0,0
,RJC,SOUTH WARWICKSHIRE NHS FOUNDATION TRUST,NON-ADMITTED,ALL CANCERS,25,25,0,100.00%,,25,0,0,0,0
,RAJ,SOUTHEND UNIVERSITY HOSPITAL NHS FOUNDATION TRUST,NON-ADMITTED,ALL CANCERS,79,78,1,98.73%,,78,1,0,0,0
,RVY,SOUTHPORT AND ORMSKIRK HOSPITAL NHS TRUST,NON-ADMITTED,ALL CANCERS,42,42,0,100.00%,,42,0,0,0,0
,RJ7,ST GEORGE'S UNIVERSITY HOSPITALS NHS FOUNDATION TRUST,NON-ADMITTED,ALL CANCERS,38,37,1,97.37%,,37,0,0,0,1
,RBN,ST HELENS AND KNOWSLEY HOSPITALS NHS TRUST,NON-ADMITTED,ALL CANCERS,39,39,0,100.00%,,39,0,0,0,0
,RWJ,STOCKPORT NHS FOUNDATION TRUST,NON-ADMITTED,ALL CANCERS,18,18,0,100.00%,,18,0,0,0,0
,RTP,SURREY AND SUSSEX HEALTHCARE NHS TRUST,NON-ADMITTED,ALL CANCERS,37,37,0,100.00%,,37,0,0,0,0
,RMP,TAMESIDE HOSPITAL NHS FOUNDATION TRUST,NON-ADMITTED,ALL CANCERS,43,43,0,100.00%,,43,0,0,0,0
,RBA,TAUNTON AND SOMERSET NHS FOUNDATION TRUST,NON-ADMITTED,ALL CANCERS,74,74,0,100.00%,,74,0,0,0,0
,RBV,THE CHRISTIE NHS FOUNDATION TRUST,NON-ADMITTED,ALL CANCERS,228,226,2,99.12%,,226,1,1,0,0
,REN,THE CLATTERBRIDGE CANCER CENTRE NHS FOUNDATION TRUST,NON-ADMITTED,ALL CANCERS,187,181,6,96.79%,,181,3,3,0,0
,RNA,THE DUDLEY GROUP NHS FOUNDATION TRUST,NON-ADMITTED,ALL CANCERS,49,49,0,100.00%,,49,0,0,0,0
,RAS,THE HILLINGDON HOSPITALS NHS FOUNDATION TRUST,NON-ADMITTED,ALL CANCERS,20,20,0,100.00%,,20,0,0,0,0
,RTD,THE NEWCASTLE UPON TYNE HOSPITALS NHS FOUNDATION TRUST,NON-ADMITTED,ALL CANCERS,140,140,0,100.00%,,140,0,0,0,0
,RQW,THE PRINCESS ALEXANDRA HOSPITAL NHS TRUST,NON-ADMITTED,ALL CANCERS,51,51,0,100.00%,,51,0,0,0,0
,RCX,"THE QUEEN ELIZABETH HOSPITAL, KING'S LYNN, NHS FOUNDATION TRUST",NON-ADMITTED,ALL CANCERS,59,59,0,100.00%,,59,0,0,0,0
,RFR,THE ROTHERHAM NHS FOUNDATION TRUST,NON-ADMITTED,ALL CANCERS,17,17,0,100.00%,,17,0,0,0,0
,RDZ,THE ROYAL BOURNEMOUTH AND CHRISTCHURCH HOSPITALS NHS FOUNDATION TRUST,NON-ADMITTED,ALL CANCERS,53,53,0,100.00%,,53,0,0,0,0
,RPY,THE ROYAL MARSDEN NHS FOUNDATION TRUST,NON-ADMITTED,ALL CANCERS,63,61,2,96.83%,,61,1,1,0,0
,RL4,THE ROYAL WOLVERHAMPTON NHS TRUST,NON-ADMITTED,ALL CANCERS,77,77,0,100.00%,,77,0,0,0,0
,RKE,THE WHITTINGTON HOSPITAL NHS TRUST,NON-ADMITTED,ALL CANCERS,4,4,0,100.00%,,4,0,0,0,0
,RWD,UNITED LINCOLNSHIRE HOSPITALS NHS TRUST,NON-ADMITTED,ALL CANCERS,147,147,0,100.00%,,147,0,0,0,0
,RRV,UNIVERSITY COLLEGE LONDON HOSPITALS NHS FOUNDATION TRUST,NON-ADMITTED,ALL CANCERS,36,32,4,88.89%,,32,2,1,0,1
,RM2,UNIVERSITY HOSPITAL OF SOUTH MANCHESTER NHS FOUNDATION TRUST,NON-ADMITTED,ALL CANCERS,19,19,0,100.00%,,19,0,0,0,0
,RHM,UNIVERSITY HOSPITAL SOUTHAMPTON NHS FOUNDATION TRUST,NON-ADMITTED,ALL CANCERS,161,157,4,97.52%,,157,1,2,1,0
,RRK,UNIVERSITY HOSPITALS BIRMINGHAM NHS FOUNDATION TRUST,NON-ADMITTED,ALL CANCERS,98,96,2,97.96%,,96,0,0,1,1
,RA7,UNIVERSITY HOSPITALS BRISTOL NHS FOUNDATION TRUST,NON-ADMITTED,ALL CANCERS,59,58,1,98.31%,,58,1,0,0,0
,RKB,UNIVERSITY HOSPITALS COVENTRY AND WARWICKSHIRE NHS TRUST,NON-ADMITTED,ALL CANCERS,55,55,0,100.00%,,55,0,0,0,0
,RWE,UNIVERSITY HOSPITALS OF LEICESTER NHS TRUST,NON-ADMITTED,ALL CANCERS,101,95,6,94.06%,,95,3,1,2,0
,RTX,UNIVERSITY HOSPITALS OF MORECAMBE BAY NHS FOUNDATION TRUST,NON-ADMITTED,ALL CANCERS,68,68,0,100.00%,,68,0,0,0,0
,RJE,UNIVERSITY HOSPITALS OF NORTH MIDLANDS NHS TRUST,NON-ADMITTED,ALL CANCERS,71,70,1,98.59%,,70,0,0,1,0
,RBK,WALSALL HEALTHCARE NHS TRUST,NON-ADMITTED,ALL CANCERS,14,14,0,100.00%,,14,0,0,0,0
,RWW,WARRINGTON AND HALTON HOSPITALS NHS FOUNDATION TRUST,NON-ADMITTED,ALL CANCERS,9,9,0,100.00%,,9,0,0,0,0
,RWG,WEST HERTFORDSHIRE HOSPITALS NHS TRUST,NON-ADMITTED,ALL CANCERS,44,44,0,100.00%,,44,0,0,0,0
,RGR,WEST SUFFOLK NHS FOUNDATION TRUST,NON-ADMITTED,ALL CANCERS,26,26,0,100.00%,,26,0,0,0,0
,RYR,WESTERN SUSSEX HOSPITALS NHS FOUNDATION TRUST,NON-ADMITTED,ALL CANCERS,95,95,0,100.00%,,95,0,0,0,0
,RA3,WESTON AREA HEALTH NHS TRUST,NON-ADMITTED,ALL CANCERS,14,14,0,100.00%,,14,0,0,0,0
,RBL,WIRRAL UNIVERSITY TEACHING HOSPITAL NHS FOUNDATION TRUST,NON-ADMITTED,ALL CANCERS,30,30,0,100.00%,,30,0,0,0,0
,RWP,WORCESTERSHIRE ACUTE HOSPITALS NHS TRUST,NON-ADMITTED,ALL CANCERS,90,90,0,100.00%,,90,0,0,0,0
,RRF,"WRIGHTINGTON, WIGAN AND LEIGH NHS FOUNDATION TRUST",NON-ADMITTED,ALL CANCERS,40,40,0,100.00%,,40,0,0,0,0
,RLQ,WYE VALLEY NHS TRUST,NON-ADMITTED,ALL CANCERS,8,8,0,100.00%,,8,0,0,0,0
,RA4,YEOVIL DISTRICT HOSPITAL NHS FOUNDATION TRUST,NON-ADMITTED,ALL CANCERS,29,29,0,100.00%,,29,0,0,0,0
,RCB,YORK TEACHING HOSPITAL NHS FOUNDATION TRUST,NON-ADMITTED,ALL CANCERS,83,83,0,100.00%,,83,0,0,0,0
,NVM,INDEPENDENT ORGANISATION,NON-ADMITTED,ALL CANCERS,3,3,0,100.00%,,3,0,0,0,0
,NYT,INDEPENDENT ORGANISATION,NON-ADMITTED,ALL CANCERS,2,2,0,100.00%,,2,0,0,0,0
,5NM,DISCONTINUED ORGANISATION,NON-ADMITTED,ALL CANCERS,2,2,0,100.00%,,2,0,0,0,0
,,,,,,,,,,,,,,
,,ALL ENGLISH PROVIDERS,NON-ADMITTED,ALL CANCERS,8080,8010,70,99.13%,,8010,30,25,10,5
,,,,,,,,,,,,,,
,,,,,,,,,,,,,,
,,,,,,,,,,,,,,
PART C:ALL CARE,,,,,,,,,,,,,,
,,,,,NUMBER OF PEOPLE RECEIVING FIRST TREATMENT FOR CANCER,,,PERCENTAGE ,,NUMBER OF PEOPLE RECEIVING FIRST TREATMENT FOR CANCER,,,,
,ODS CODE (1),PROVIDER (4) (5),CARE SETTING (2),CANCER TYPE,TOTAL,WITHIN 31 DAYS,AFTER 31 DAYS,TREATED WITHIN 31 DAYS,,WITHIN 31 DAYS,32 TO 38 DAYS,39 TO 48 DAYS,49 TO 62 DAYS,AFTER 62 DAYS
,REM,AINTREE UNIVERSITY HOSPITAL NHS FOUNDATION TRUST,ALL CARE,ALL CANCERS,117,116,1,99.15%,,116,1,0,0,0
,RCF,AIREDALE NHS FOUNDATION TRUST,ALL CARE,ALL CANCERS,76,76,0,100.00%,,76,0,0,0,0
,RBS,ALDER HEY CHILDREN'S NHS FOUNDATION TRUST,ALL CARE,ALL CANCERS,6,6,0,100.00%,,6,0,0,0,0
,RTK,ASHFORD AND ST PETER'S HOSPITALS NHS FOUNDATION TRUST,ALL CARE,ALL CANCERS,99,98,1,98.99%,,98,1,0,0,0
,RF4,"BARKING, HAVERING AND REDBRIDGE UNIVERSITY HOSPITALS NHS TRUST",ALL CARE,ALL CANCERS,186,182,4,97.85%,,182,2,0,1,1
,RFF,BARNSLEY HOSPITAL NHS FOUNDATION TRUST,ALL CARE,ALL CANCERS,71,71,0,100.00%,,71,0,0,0,0
,R1H,BARTS HEALTH NHS TRUST,ALL CARE,ALL CANCERS,284,275,9,96.83%,,275,4,4,1,0
,RDD,BASILDON AND THURROCK UNIVERSITY HOSPITALS NHS FOUNDATION TRUST,ALL CARE,ALL CANCERS,130,125,5,96.15%,,125,3,0,0,2
,RC1,BEDFORD HOSPITAL NHS TRUST,ALL CARE,ALL CANCERS,101,101,0,100.00%,,101,0,0,0,0
,RQ3,BIRMINGHAM CHILDREN'S HOSPITAL NHS FOUNDATION TRUST,ALL CARE,ALL CANCERS,15,15,0,100.00%,,15,0,0,0,0
,RLU,BIRMINGHAM WOMEN'S NHS FOUNDATION TRUST,ALL CARE,ALL CANCERS,2,2,0,100.00%,,2,0,0,0,0
,RXL,BLACKPOOL TEACHING HOSPITALS NHS FOUNDATION TRUST,ALL CARE,ALL CANCERS,154,153,1,99.35%,,153,1,0,0,0
,RMC,BOLTON NHS FOUNDATION TRUST,ALL CARE,ALL CANCERS,95,94,1,98.95%,,94,0,1,0,0
,RAE,BRADFORD TEACHING HOSPITALS NHS FOUNDATION TRUST,ALL CARE,ALL CANCERS,137,134,3,97.81%,,134,2,1,0,0
,RY2,BRIDGEWATER COMMUNITY HEALTHCARE NHS FOUNDATION TRUST,ALL CARE,ALL CANCERS,9,9,0,100.00%,,9,0,0,0,0
,RXH,BRIGHTON AND SUSSEX UNIVERSITY HOSPITALS NHS TRUST,ALL CARE,ALL CANCERS,230,221,9,96.09%,,221,3,2,3,1
,RXQ,BUCKINGHAMSHIRE HEALTHCARE NHS TRUST,ALL CARE,ALL CANCERS,148,147,1,99.32%,,147,1,0,0,0
,RJF,BURTON HOSPITALS NHS FOUNDATION TRUST,ALL CARE,ALL CANCERS,85,84,1,98.82%,,84,1,0,0,0
,RWY,CALDERDALE AND HUDDERSFIELD NHS FOUNDATION TRUST,ALL CARE,ALL CANCERS,132,132,0,100.00%,,132,0,0,0,0
,RGT,CAMBRIDGE UNIVERSITY HOSPITALS NHS FOUNDATION TRUST,ALL CARE,ALL CANCERS,259,249,10,96.14%,,249,6,1,1,2
,RW3,CENTRAL MANCHESTER UNIVERSITY HOSPITALS NHS FOUNDATION TRUST,ALL CARE,ALL CANCERS,110,108,2,98.18%,,108,1,0,1,0
,RQM,CHELSEA AND WESTMINSTER HOSPITAL NHS FOUNDATION TRUST,ALL CARE,ALL CANCERS,55,55,0,100.00%,,55,0,0,0,0
,RFS,CHESTERFIELD ROYAL HOSPITAL NHS FOUNDATION TRUST,ALL CARE,ALL CANCERS,106,105,1,99.06%,,105,0,1,0,0
,RLN,CITY HOSPITALS SUNDERLAND NHS FOUNDATION TRUST,ALL CARE,ALL CANCERS,159,159,0,100.00%,,159,0,0,0,0
,RDE,COLCHESTER HOSPITAL UNIVERSITY NHS FOUNDATION TRUST,ALL CARE,ALL CANCERS,187,180,7,96.26%,,180,2,3,0,2
,RJR,COUNTESS OF CHESTER HOSPITAL NHS FOUNDATION TRUST,ALL CARE,ALL CANCERS,94,92,2,97.87%,,92,1,0,0,1
,RXP,COUNTY DURHAM AND DARLINGTON NHS FOUNDATION TRUST,ALL CARE,ALL CANCERS,183,182,1,99.45%,,182,0,1,0,0
,RJ6,CROYDON HEALTH SERVICES NHS TRUST,ALL CARE,ALL CANCERS,69,68,1,98.55%,,68,1,0,0,0
,RN7,DARTFORD AND GRAVESHAM NHS TRUST,ALL CARE,ALL CANCERS,56,55,1,98.21%,,55,0,1,0,0
,RTG,DERBY TEACHING HOSPITALS NHS FOUNDATION TRUST,ALL CARE,ALL CANCERS,270,258,12,95.56%,,258,5,3,2,2
,RP5,DONCASTER AND BASSETLAW HOSPITALS NHS FOUNDATION TRUST,ALL CARE,ALL CANCERS,143,141,2,98.60%,,141,0,1,1,0
,RBD,DORSET COUNTY HOSPITAL NHS FOUNDATION TRUST,ALL CARE,ALL CANCERS,104,103,1,99.04%,,103,0,1,0,0
,RWH,EAST AND NORTH HERTFORDSHIRE NHS TRUST,ALL CARE,ALL CANCERS,211,206,5,97.63%,,206,2,2,1,0
,RJN,EAST CHESHIRE NHS TRUST,ALL CARE,ALL CANCERS,75,75,0,100.00%,,75,0,0,0,0
,RVV,EAST KENT HOSPITALS UNIVERSITY NHS FOUNDATION TRUST,ALL CARE,ALL CANCERS,252,243,9,96.43%,,243,2,3,2,2
,RXR,EAST LANCASHIRE HOSPITALS NHS TRUST,ALL CARE,ALL CANCERS,162,162,0,100.00%,,162,0,0,0,0
,RXC,EAST SUSSEX HEALTHCARE NHS TRUST,ALL CARE,ALL CANCERS,175,175,0,100.00%,,175,0,0,0,0
,RVR,EPSOM AND ST HELIER UNIVERSITY HOSPITALS NHS TRUST,ALL CARE,ALL CANCERS,58,57,1,98.28%,,57,0,1,0,0
,RDU,FRIMLEY HEALTH NHS FOUNDATION TRUST,ALL CARE,ALL CANCERS,104,103,1,99.04%,,103,1,0,0,0
,RR7,GATESHEAD HEALTH NHS FOUNDATION TRUST,ALL CARE,ALL CANCERS,140,140,0,100.00%,,140,0,0,0,0
,RLT,GEORGE ELIOT HOSPITAL NHS TRUST,ALL CARE,ALL CANCERS,49,49,0,100.00%,,49,0,0,0,0
,RTE,GLOUCESTERSHIRE HOSPITALS NHS FOUNDATION TRUST,ALL CARE,ALL CANCERS,335,335,0,100.00%,,335,0,0,0,0
,RP4,GREAT ORMOND STREET HOSPITAL FOR CHILDREN NHS FOUNDATION TRUST,ALL CARE,ALL CANCERS,16,16,0,100.00%,,16,0,0,0,0
,RN3,GREAT WESTERN HOSPITALS NHS FOUNDATION TRUST,ALL CARE,ALL CANCERS,127,124,3,97.64%,,124,1,2,0,0
,RJ1,GUY'S AND ST THOMAS' NHS FOUNDATION TRUST,ALL CARE,ALL CANCERS,304,289,15,95.07%,,289,3,9,1,2
,RN5,HAMPSHIRE HOSPITALS NHS FOUNDATION TRUST,ALL CARE,ALL CANCERS,185,181,4,97.84%,,181,2,1,0,1
,RCD,HARROGATE AND DISTRICT NHS FOUNDATION TRUST,ALL CARE,ALL CANCERS,87,86,1,98.85%,,86,0,1,0,0
,RR1,HEART OF ENGLAND NHS FOUNDATION TRUST,ALL CARE,ALL CANCERS,309,304,5,98.38%,,304,2,3,0,0
,RD7,HEATHERWOOD AND WEXHAM PARK HOSPITALS NHS FOUNDATION TRUST,ALL CARE,ALL CANCERS,117,117,0,100.00%,,117,0,0,0,0
,RQQ,HINCHINGBROOKE HEALTH CARE NHS TRUST,ALL CARE,ALL CANCERS,56,55,1,98.21%,,55,0,1,0,0
,RQX,HOMERTON UNIVERSITY HOSPITAL NHS FOUNDATION TRUST,ALL CARE,ALL CANCERS,34,34,0,100.00%,,34,0,0,0,0
,RWA,HULL AND EAST YORKSHIRE HOSPITALS NHS TRUST,ALL CARE,ALL CANCERS,284,277,7,97.54%,,277,3,2,1,1
,RYJ,IMPERIAL COLLEGE HEALTHCARE NHS TRUST,ALL CARE,ALL CANCERS,228,223,5,97.81%,,223,2,1,2,0
,RGQ,IPSWICH HOSPITAL NHS TRUST,ALL CARE,ALL CANCERS,177,170,7,96.05%,,170,4,2,1,0
,R1F,ISLE OF WIGHT NHS TRUST,ALL CARE,ALL CANCERS,78,78,0,100.00%,,78,0,0,0,0
,RGP,JAMES PAGET UNIVERSITY HOSPITALS NHS FOUNDATION TRUST,ALL CARE,ALL CANCERS,106,106,0,100.00%,,106,0,0,0,0
,RNQ,KETTERING GENERAL HOSPITAL NHS FOUNDATION TRUST,ALL CARE,ALL CANCERS,111,110,1,99.10%,,110,1,0,0,0
,RJZ,KING'S COLLEGE HOSPITAL NHS FOUNDATION TRUST,ALL CARE,ALL CANCERS,211,211,0,100.00%,,211,0,0,0,0
,RAX,KINGSTON HOSPITAL NHS FOUNDATION TRUST,ALL CARE,ALL CANCERS,63,61,2,96.83%,,61,1,0,1,0
,RXN,LANCASHIRE TEACHING HOSPITALS NHS FOUNDATION TRUST,ALL CARE,ALL CANCERS,244,239,5,97.95%,,239,4,0,0,1
,RR8,LEEDS TEACHING HOSPITALS NHS TRUST,ALL CARE,ALL CANCERS,470,462,8,98.30%,,462,2,5,1,0
,RJ2,LEWISHAM AND GREENWICH NHS TRUST,ALL CARE,ALL CANCERS,81,79,2,97.53%,,79,1,0,1,0
,RBQ,LIVERPOOL HEART AND CHEST HOSPITAL NHS FOUNDATION TRUST,ALL CARE,ALL CANCERS,51,50,1,98.04%,,50,1,0,0,0
,REP,LIVERPOOL WOMEN'S NHS FOUNDATION TRUST,ALL CARE,ALL CANCERS,38,38,0,100.00%,,38,0,0,0,0
,R1K,LONDON NORTH WEST HEALTHCARE NHS TRUST,ALL CARE,ALL CANCERS,133,131,2,98.50%,,131,2,0,0,0
,RC9,LUTON AND DUNSTABLE UNIVERSITY HOSPITAL NHS FOUNDATION TRUST,ALL CARE,ALL CANCERS,119,119,0,100.00%,,119,0,0,0,0
,RWF,MAIDSTONE AND TUNBRIDGE WELLS NHS TRUST,ALL CARE,ALL CANCERS,204,196,8,96.08%,,196,6,2,0,0
,RPA,MEDWAY NHS FOUNDATION TRUST,ALL CARE,ALL CANCERS,141,131,10,92.91%,,131,5,2,2,1
,RBT,MID CHESHIRE HOSPITALS NHS FOUNDATION TRUST,ALL CARE,ALL CANCERS,91,90,1,98.90%,,90,0,1,0,0
,RQ8,MID ESSEX HOSPITAL SERVICES NHS TRUST,ALL CARE,ALL CANCERS,197,182,15,92.39%,,182,7,5,2,1
,RXF,MID YORKSHIRE HOSPITALS NHS TRUST,ALL CARE,ALL CANCERS,171,171,0,100.00%,,171,0,0,0,0
,RD8,MILTON KEYNES HOSPITAL NHS FOUNDATION TRUST,ALL CARE,ALL CANCERS,71,69,2,97.18%,,69,1,1,0,0
,RP6,MOORFIELDS EYE HOSPITAL NHS FOUNDATION TRUST,ALL CARE,ALL CANCERS,18,18,0,100.00%,,18,0,0,0,0
,RM1,NORFOLK AND NORWICH UNIVERSITY HOSPITALS NHS FOUNDATION TRUST,ALL CARE,ALL CANCERS,364,356,8,97.80%,,356,3,0,2,3
,RVJ,NORTH BRISTOL NHS TRUST,ALL CARE,ALL CANCERS,285,274,11,96.14%,,274,2,5,2,2
,RNL,NORTH CUMBRIA UNIVERSITY HOSPITALS NHS TRUST,ALL CARE,ALL CANCERS,120,117,3,97.50%,,117,1,1,1,0
,RAP,NORTH MIDDLESEX UNIVERSITY HOSPITAL NHS TRUST,ALL CARE,ALL CANCERS,78,78,0,100.00%,,78,0,0,0,0
,RVW,NORTH TEES AND HARTLEPOOL NHS FOUNDATION TRUST,ALL CARE,ALL CANCERS,100,100,0,100.00%,,100,0,0,0,0
,RNS,NORTHAMPTON GENERAL HOSPITAL NHS TRUST,ALL CARE,ALL CANCERS,134,127,7,94.78%,,127,5,1,1,0
,RP1,NORTHAMPTONSHIRE HEALTHCARE NHS FOUNDATION TRUST,ALL CARE,ALL CANCERS,1,1,0,100.00%,,1,0,0,0,0
,RBZ,NORTHERN DEVON HEALTHCARE NHS TRUST,ALL CARE,ALL CANCERS,69,65,4,94.20%,,65,2,1,1,0
,RJL,NORTHERN LINCOLNSHIRE AND GOOLE NHS FOUNDATION TRUST,ALL CARE,ALL CANCERS,142,142,0,100.00%,,142,0,0,0,0
,RTF,NORTHUMBRIA HEALTHCARE NHS FOUNDATION TRUST,ALL CARE,ALL CANCERS,128,127,1,99.22%,,127,0,0,0,1
,RX1,NOTTINGHAM UNIVERSITY HOSPITALS NHS TRUST,ALL CARE,ALL CANCERS,370,357,13,96.49%,,357,3,4,3,3
,RTH,OXFORD UNIVERSITY HOSPITALS NHS TRUST,ALL CARE,ALL CANCERS,339,334,5,98.53%,,334,2,2,1,0
,RGM,PAPWORTH HOSPITAL NHS FOUNDATION TRUST,ALL CARE,ALL CANCERS,9,9,0,100.00%,,9,0,0,0,0
,RW6,PENNINE ACUTE HOSPITALS NHS TRUST,ALL CARE,ALL CANCERS,154,153,1,99.35%,,153,1,0,0,0
,RGN,PETERBOROUGH AND STAMFORD HOSPITALS NHS FOUNDATION TRUST,ALL CARE,ALL CANCERS,134,134,0,100.00%,,134,0,0,0,0
,RK9,PLYMOUTH HOSPITALS NHS TRUST,ALL CARE,ALL CANCERS,325,317,8,97.54%,,317,6,1,1,0
,RD3,POOLE HOSPITAL NHS FOUNDATION TRUST,ALL CARE,ALL CANCERS,139,138,1,99.28%,,138,1,0,0,0
,RHU,PORTSMOUTH HOSPITALS NHS TRUST,ALL CARE,ALL CANCERS,289,283,6,97.92%,,283,2,3,1,0
,RPC,QUEEN VICTORIA HOSPITAL NHS FOUNDATION TRUST,ALL CARE,ALL CANCERS,66,63,3,95.45%,,63,3,0,0,0
,RHW,ROYAL BERKSHIRE NHS FOUNDATION TRUST,ALL CARE,ALL CANCERS,181,173,8,95.58%,,173,2,5,1,0
,RT3,ROYAL BROMPTON & HAREFIELD NHS FOUNDATION TRUST,ALL CARE,ALL CANCERS,45,43,2,95.56%,,43,1,0,1,0
,REF,ROYAL CORNWALL HOSPITALS NHS TRUST,ALL CARE,ALL CANCERS,255,245,10,96.08%,,245,3,6,1,0
,RH8,ROYAL DEVON AND EXETER NHS FOUNDATION TRUST,ALL CARE,ALL CANCERS,332,296,36,89.16%,,296,8,14,6,8
,RAL,ROYAL FREE LONDON NHS FOUNDATION TRUST,ALL CARE,ALL CANCERS,255,254,1,99.61%,,254,0,1,0,0
,RQ6,ROYAL LIVERPOOL AND BROADGREEN UNIVERSITY HOSPITALS NHS TRUST,ALL CARE,ALL CANCERS,120,117,3,97.50%,,117,0,0,0,3
,RAN,ROYAL NATIONAL ORTHOPAEDIC HOSPITAL NHS TRUST,ALL CARE,ALL CANCERS,17,17,0,100.00%,,17,0,0,0,0
,RA2,ROYAL SURREY COUNTY HOSPITAL NHS FOUNDATION TRUST,ALL CARE,ALL CANCERS,220,217,3,98.64%,,217,2,0,1,0
,RD1,ROYAL UNITED HOSPITALS BATH NHS FOUNDATION TRUST,ALL CARE,ALL CANCERS,170,170,0,100.00%,,170,0,0,0,0
,RM3,SALFORD ROYAL NHS FOUNDATION TRUST,ALL CARE,ALL CANCERS,143,137,6,95.80%,,137,0,1,4,1
,RNZ,SALISBURY NHS FOUNDATION TRUST,ALL CARE,ALL CANCERS,84,84,0,100.00%,,84,0,0,0,0
,RXK,SANDWELL AND WEST BIRMINGHAM HOSPITALS NHS TRUST,ALL CARE,ALL CANCERS,131,127,4,96.95%,,127,1,3,0,0
,RCU,SHEFFIELD CHILDREN'S NHS FOUNDATION TRUST,ALL CARE,ALL CANCERS,9,9,0,100.00%,,9,0,0,0,0
,RHQ,SHEFFIELD TEACHING HOSPITALS NHS FOUNDATION TRUST,ALL CARE,ALL CANCERS,478,469,9,98.12%,,469,5,0,3,1
,RK5,SHERWOOD FOREST HOSPITALS NHS FOUNDATION TRUST,ALL CARE,ALL CANCERS,114,114,0,100.00%,,114,0,0,0,0
,RXW,SHREWSBURY AND TELFORD HOSPITAL NHS TRUST,ALL CARE,ALL CANCERS,232,227,5,97.84%,,227,2,1,2,0
,RA9,SOUTH DEVON HEALTHCARE NHS FOUNDATION TRUST,ALL CARE,ALL CANCERS,178,172,6,96.63%,,172,3,2,1,0
,RTR,SOUTH TEES HOSPITALS NHS FOUNDATION TRUST,ALL CARE,ALL CANCERS,245,237,8,96.73%,,237,1,4,2,1
,RE9,SOUTH TYNESIDE NHS FOUNDATION TRUST,ALL CARE,ALL CANCERS,27,27,0,100.00%,,27,0,0,0,0
,RJC,SOUTH WARWICKSHIRE NHS FOUNDATION TRUST,ALL CARE,ALL CANCERS,68,68,0,100.00%,,68,0,0,0,0
,RAJ,SOUTHEND UNIVERSITY HOSPITAL NHS FOUNDATION TRUST,ALL CARE,ALL CANCERS,167,161,6,96.41%,,161,2,1,2,1
,RVY,SOUTHPORT AND ORMSKIRK HOSPITAL NHS TRUST,ALL CARE,ALL CANCERS,75,73,2,97.33%,,73,1,0,1,0
,RJ7,ST GEORGE'S UNIVERSITY HOSPITALS NHS FOUNDATION TRUST,ALL CARE,ALL CANCERS,155,149,6,96.13%,,149,4,0,0,2
,RBN,ST HELENS AND KNOWSLEY HOSPITALS NHS TRUST,ALL CARE,ALL CANCERS,203,198,5,97.54%,,198,4,0,0,1
,RWJ,STOCKPORT NHS FOUNDATION TRUST,ALL CARE,ALL CANCERS,74,74,0,100.00%,,74,0,0,0,0
,RTP,SURREY AND SUSSEX HEALTHCARE NHS TRUST,ALL CARE,ALL CANCERS,112,110,2,98.21%,,110,0,1,1,0
,RMP,TAMESIDE HOSPITAL NHS FOUNDATION TRUST,ALL CARE,ALL CANCERS,71,71,0,100.00%,,71,0,0,0,0
,RBA,TAUNTON AND SOMERSET NHS FOUNDATION TRUST,ALL CARE,ALL CANCERS,183,179,4,97.81%,,179,4,0,0,0
,RBV,THE CHRISTIE NHS FOUNDATION TRUST,ALL CARE,ALL CANCERS,300,297,3,99.00%,,297,2,1,0,0
,REN,THE CLATTERBRIDGE CANCER CENTRE NHS FOUNDATION TRUST,ALL CARE,ALL CANCERS,215,207,8,96.28%,,207,5,3,0,0
,RNA,THE DUDLEY GROUP NHS FOUNDATION TRUST,ALL CARE,ALL CANCERS,148,146,2,98.65%,,146,2,0,0,0
,RAS,THE HILLINGDON HOSPITALS NHS FOUNDATION TRUST,ALL CARE,ALL CANCERS,50,50,0,100.00%,,50,0,0,0,0
,RTD,THE NEWCASTLE UPON TYNE HOSPITALS NHS FOUNDATION TRUST,ALL CARE,ALL CANCERS,448,436,12,97.32%,,436,3,5,2,2
,RQW,THE PRINCESS ALEXANDRA HOSPITAL NHS TRUST,ALL CARE,ALL CANCERS,112,112,0,100.00%,,112,0,0,0,0
,RCX,"THE QUEEN ELIZABETH HOSPITAL, KING'S LYNN, NHS FOUNDATION TRUST",ALL CARE,ALL CANCERS,111,111,0,100.00%,,111,0,0,0,0
,RL1,THE ROBERT JONES AND AGNES HUNT ORTHOPAEDIC HOSPITAL NHS FOUNDATION TRUST,ALL CARE,ALL CANCERS,2,2,0,100.00%,,2,0,0,0,0
,RFR,THE ROTHERHAM NHS FOUNDATION TRUST,ALL CARE,ALL CANCERS,72,72,0,100.00%,,72,0,0,0,0
,RDZ,THE ROYAL BOURNEMOUTH AND CHRISTCHURCH HOSPITALS NHS FOUNDATION TRUST,ALL CARE,ALL CANCERS,188,177,11,94.15%,,177,1,3,2,5
,RPY,THE ROYAL MARSDEN NHS FOUNDATION TRUST,ALL CARE,ALL CANCERS,207,204,3,98.55%,,204,1,1,1,0
,RRJ,THE ROYAL ORTHOPAEDIC HOSPITAL NHS FOUNDATION TRUST,ALL CARE,ALL CANCERS,11,11,0,100.00%,,11,0,0,0,0
,RL4,THE ROYAL WOLVERHAMPTON NHS TRUST,ALL CARE,ALL CANCERS,230,224,6,97.39%,,224,1,1,1,3
,RET,THE WALTON CENTRE NHS FOUNDATION TRUST,ALL CARE,ALL CANCERS,10,10,0,100.00%,,10,0,0,0,0
,RKE,THE WHITTINGTON HOSPITAL NHS TRUST,ALL CARE,ALL CANCERS,30,30,0,100.00%,,30,0,0,0,0
,RWD,UNITED LINCOLNSHIRE HOSPITALS NHS TRUST,ALL CARE,ALL CANCERS,318,315,3,99.06%,,315,0,1,0,2
,RRV,UNIVERSITY COLLEGE LONDON HOSPITALS NHS FOUNDATION TRUST,ALL CARE,ALL CANCERS,223,211,12,94.62%,,211,3,3,2,4
,RM2,UNIVERSITY HOSPITAL OF SOUTH MANCHESTER NHS FOUNDATION TRUST,ALL CARE,ALL CANCERS,204,201,3,98.53%,,201,2,0,1,0
,RHM,UNIVERSITY HOSPITAL SOUTHAMPTON NHS FOUNDATION TRUST,ALL CARE,ALL CANCERS,345,333,12,96.52%,,333,4,5,2,1
,RRK,UNIVERSITY HOSPITALS BIRMINGHAM NHS FOUNDATION TRUST,ALL CARE,ALL CANCERS,255,246,9,96.47%,,246,5,2,1,1
,RA7,UNIVERSITY HOSPITALS BRISTOL NHS FOUNDATION TRUST,ALL CARE,ALL CANCERS,232,229,3,98.71%,,229,1,0,0,2
,RKB,UNIVERSITY HOSPITALS COVENTRY AND WARWICKSHIRE NHS TRUST,ALL CARE,ALL CANCERS,191,191,0,100.00%,,191,0,0,0,0
,RWE,UNIVERSITY HOSPITALS OF LEICESTER NHS TRUST,ALL CARE,ALL CANCERS,355,338,17,95.21%,,338,8,2,5,2
,RTX,UNIVERSITY HOSPITALS OF MORECAMBE BAY NHS FOUNDATION TRUST,ALL CARE,ALL CANCERS,153,153,0,100.00%,,153,0,0,0,0
,RJE,UNIVERSITY HOSPITALS OF NORTH MIDLANDS NHS TRUST,ALL CARE,ALL CANCERS,311,305,6,98.07%,,305,2,2,2,0
,RBK,WALSALL HEALTHCARE NHS TRUST,ALL CARE,ALL CANCERS,83,83,0,100.00%,,83,0,0,0,0
,RWW,WARRINGTON AND HALTON HOSPITALS NHS FOUNDATION TRUST,ALL CARE,ALL CANCERS,32,32,0,100.00%,,32,0,0,0,0
,RWG,WEST HERTFORDSHIRE HOSPITALS NHS TRUST,ALL CARE,ALL CANCERS,120,119,1,99.17%,,119,0,0,0,1
,RGR,WEST SUFFOLK NHS FOUNDATION TRUST,ALL CARE,ALL CANCERS,110,110,0,100.00%,,110,0,0,0,0
,RYR,WESTERN SUSSEX HOSPITALS NHS FOUNDATION TRUST,ALL CARE,ALL CANCERS,269,266,3,98.88%,,266,2,0,1,0
,RA3,WESTON AREA HEALTH NHS TRUST,ALL CARE,ALL CANCERS,32,31,1,96.88%,,31,1,0,0,0
,RBL,WIRRAL UNIVERSITY TEACHING HOSPITAL NHS FOUNDATION TRUST,ALL CARE,ALL CANCERS,147,144,3,97.96%,,144,2,1,0,0
,RWP,WORCESTERSHIRE ACUTE HOSPITALS NHS TRUST,ALL CARE,ALL CANCERS,252,243,9,96.43%,,243,0,1,3,5
,RRF,"WRIGHTINGTON, WIGAN AND LEIGH NHS FOUNDATION TRUST",ALL CARE,ALL CANCERS,114,113,1,99.12%,,113,0,1,0,0
,RLQ,WYE VALLEY NHS TRUST,ALL CARE,ALL CANCERS,57,55,2,96.49%,,55,1,1,0,0
,RA4,YEOVIL DISTRICT HOSPITAL NHS FOUNDATION TRUST,ALL CARE,ALL CANCERS,71,70,1,98.59%,,70,1,0,0,0
,RCB,YORK TEACHING HOSPITAL NHS FOUNDATION TRUST,ALL CARE,ALL CANCERS,248,247,1,99.60%,,247,1,0,0,0
,NV3,INDEPENDENT ORGANISATION,ALL CARE,ALL CANCERS,40,38,2,95.00%,,38,1,0,1,0
,NVM,INDEPENDENT ORGANISATION,ALL CARE,ALL CANCERS,10,10,0,100.00%,,10,0,0,0,0
,NYT,INDEPENDENT ORGANISATION,ALL CARE,ALL CANCERS,3,3,0,100.00%,,3,0,0,0,0
,5NM,DISCONTINUED ORGANISATION,ALL CARE,ALL CANCERS,2,2,0,100.00%,,2,0,0,0,0
,RFW,DISCONTINUED ORGANISATION,ALL CARE,ALL CANCERS,1,1,0,100.00%,,1,0,0,0,0
,,,,,,,,,,,,,,
,,ALL ENGLISH PROVIDERS,ALL CARE,ALL CANCERS,23857,23329,528,97.79%,,23329,211,154,88,75
,,,,,,,,,,,,,,
,,,,,,,,,,,,,,
,,,,,,,,,,,,,,
,,,,,,,,,,,,,,
,,,,,,,,,,,,,,
,,,,,,,,,,,,,,
,,,,,,,,,,,,,,
,,,,,,,,,,,,,,
,,,,,,,,,,,,,,
,,,,,,,,,,,,,,
